"gloss","target_child_name","part_of_speech","target_child_sex"
"oh there she is she's dressed in a sweater and a scarf and shoes",NA,"co adv pro:sub cop pro:sub part prep det:art n coord det:art n coord n","female"
"nice and summery dressed for the weather",NA,"adj coord adj v prep det:art n","female"
"Max took his ear splitter space cadet and dressed him in Mrs Quacks",NA,"n:prop v det:poss n n n n coord v pro:obj prep n:prop n:prop","female"
"oh you can hide in the closet when I get dressed",NA,"co pro:per mod v prep det:art n conj pro:sub aux part","female"
"I was thinking we might give this dress to xxx it might be too small for you shall we just take a look",NA,"pro:sub aux part pro:sub mod v det:dem n prep pro:per mod cop adv adj prep pro:per mod pro:sub adv v det:art co","female"
"it's a dress",NA,"pro:per det:art n","female"
"this is a dress that used to be Mommy's when I was little",NA,"pro:dem cop det:art n pro:rel v inf cop adj conj pro:sub cop adj","female"
"she's wearing a dress that looks like overalls",NA,"pro:sub part det:art n pro:rel v prep n:pt","female"
"and Pappy I want you to guess what where is Mommy going to go after she gets dressed this morning",NA,"coord n:prop pro:sub v pro:per prep n pro:int pro:int aux n:prop part inf v prep pro:sub v v det:dem n","female"
"where do you think Mommy might go after she gets dressed this morning",NA,"pro:int mod pro:per v n:prop mod v prep pro:sub v v det:dem n","female"
"hey did you put that dress on the daddy",NA,"co mod pro:per v pro:dem n prep det:art n","female"
"I think we're gonna need to get dressed to go to the gym class soon",NA,"pro:sub v pro:sub part v inf aux part inf v prep det:art n n adv","female"
"in fact Naima it's time to get dressed",NA,"prep n n:prop pro:per n inf aux part","female"
"well miss Violet shall we get you dressed sometime",NA,"co n n:prop mod pro:sub v pro:per v adv","female"
"you gotta get your clothes on your not dressed yet",NA,"pro:per mod v det:poss n:pt adv det:poss neg part adv","female"
"wanna play toys this morning with the babies you hafta come and get dressed come on",NA,"v n v det:dem n prep det:art n pro:per mod v coord aux part v adv","female"
"here's her pretty dress",NA,"pro:exist det:poss adj n","female"
"we color her dress in",NA,"pro:sub v det:poss n adv","female"
"I've got to get dressed now and come and help you some more",NA,"pro:sub part inf aux part adv coord v coord v pro:per qn pro:indef","female"
"you wanna get dressed for the day",NA,"pro:per v v v prep det:art n","female"
"Ruby tried on many dresses",NA,"n:prop v prep qn n","female"
"Clifford and I dressed up Clifford looked like",NA,"n:prop coord pro:sub v adv n:prop v prep","female"
"I'll make her have a brown dress",NA,"pro:sub v pro:obj v det:art adj n","female"
"you remember when I dressed up as a witch",NA,"pro:per v conj pro:sub v adv prep det:art n","female"
"and I had a brown dress",NA,"coord pro:sub v det:art adj n","female"
"they dressed up in old+fashioned clothes",NA,"pro:sub v adv prep n:pt","female"
"Clifford and I dressed up too",NA,"n:prop coord pro:sub v adv adv","female"
"okay I'm still coloring my dress here",NA,"co pro:sub adv part det:poss n adv","female"
"a brown dress",NA,"det:art adj n","female"
"yeah she's dressed as a clown",NA,"co pro:sub part prep det:art n","female"
"what's this boy dressed as",NA,"pro:int det:dem n part adv","female"
"actually I'm wearing a dress today",NA,"adv pro:sub part det:art n adv:tem","female"
"this is a dress",NA,"pro:dem cop det:art n","female"
"xxx Maisy dresses up",NA,"n:prop v adv","female"
"do you wanna wear a pretty christmas dress",NA,"mod pro:per v v det:art adj n n","female"
"Mommy and Tess get dressed for a walk",NA,"n:prop coord n:prop aux part prep det:art n","female"
"here's the pretty dress",NA,"adv cop det:art adj n","female"
"oh yeah dolphin dress",NA,"co co n n","female"
"I'm gonna dress this bear and you dress the other bear",NA,"pro:sub part v det:dem n coord pro:per v det:art qn n","female"
"I'll dress this guy and you dress this guy",NA,"pro:sub v det:dem n coord pro:per v det:dem n","female"
"Winnie_The_Pooh dress is clean",NA,"n:prop n cop adj","female"
"it should be done by the time you wanna get dressed for today you wanna wear it today",NA,"pro:per mod cop part prep det:art n pro:per v v v prep adv:tem pro:per v v pro:per adv:tem","female"
"oh here's your dolphin dress",NA,"co pro:exist det:poss n n","female"
"whose favorite dress is this",NA,"pro:rel n n cop pro:dem","female"
"we need a hairdresser this is a hair shop too",NA,"pro:sub v det:art pro:dem cop det:art n n adv","female"
"do dress up your dog in underwear",NA,"mod v prep det:poss n prep n","female"
"don't you think it should be do dress your dog up in underwear not dress up your dog",NA,"mod pro:per v pro:per mod cop mod v det:poss n adv prep n neg v adv det:poss n","female"
"do wear fancy underwear under your dress",NA,"mod v n n adv det:poss n","female"
"and when it's raining we don't go out well I mean if we're dressed appropriately and we don't have a cold sometime we can go out and play in the rain",NA,"coord conj pro:per part pro:sub mod v adv n pro:sub v comp pro:sub part adv coord pro:sub mod v det:art n adv pro:sub mod v adv coord n prep det:art n","male"
"how about we get dressed",NA,"pro:int adv pro:sub aux part","male"
"do you wanna get dressed in here",NA,"mod pro:per v v part prep n","male"
"it easier for Mommy to get you dressed right here",NA,"pro:per adj prep n:prop inf v pro:per v adv adv","male"
"we're gonna take them off soon we're gonna get dressed",NA,"pro:sub part v pro:obj adv adj pro:sub part inf aux part","male"
"let's do the puzzle and we'll get dressed",NA,"v v det:art n coord pro:sub aux part","male"
"we're not even dressed",NA,"pro:sub neg adv part","male"
"come see Mama we'll get dressed",NA,"v v n:prop pro:sub aux part","male"
"can you help Mama get you dressed",NA,"mod pro:per v n:prop v pro:per v","male"
"come we'll get dressed and we can read those books you wanted to read",NA,"v pro:sub aux part coord pro:sub mod v det:dem n pro:per v inf v","male"
"go get dressed put on the clothes that you like best",NA,"v aux part v prep det:art n:pt comp pro:per v adj","male"
"dress",NA,"n","male"
"he wants to get dressed and then he doesn't want to get dressed and he just gets himself in a tizzy like this",NA,"pro:sub v inf aux part coord adv:tem pro:sub mod v inf aux part coord pro:sub adv v pro:refl prep det:art n prep pro:dem","male"
"d'you wanna go upstairs and get Bob's Busy Saw and your clothes because it'd be good for you to get dressed",NA,"mod pro:per v v adv coord v adj n:prop n:prop coord det:poss n:pt conj pro:per cop adj prep pro:per inf aux part","male"
"what are these on Mommy's dress",NA,"pro:int cop pro:dem prep adj n","male"
"what's on Mommy's dress",NA,"pro:int prep adj n","male"
"I wasn't really thinking when I got dressed this morning was I though",NA,"pro:sub aux adv part conj pro:sub v part det:dem n cop pro:sub adv","male"
"ah is that William dressed up like a fireman",NA,"co cop comp n:prop v adv prep det:art","male"
"we hafta get William dressed Mommy has to finish her breakfast maybe William will have a little bit more to eat or maybe you'll have some banana or some apple",NA,"pro:sub mod v n:prop part n:prop aux inf v det:poss n adv n:prop mod v det:art adj n adv inf v coord adv pro:per v qn n coord qn n","male"
"well why don't you wait til we get dressed don't you can't this is buttoned so we don't pull that because it might break",NA,"n pro:rel mod pro:per v conj pro:sub aux part mod pro:per mod pro:dem aux part co pro:sub mod v comp conj pro:per mod v","male"
